<?xml version="1.0" encoding="UTF-8"?>
<!DOCTYPE digxml SYSTEM "Z:\DigXML\DIG-XML.dtd">
<digxml version="0.7" source="TIBCO" timestamp="2005-06-20T13:42:55.2425Z">
 <message serial="1">
   <write entity="flight_leg_pax">
     <value name="udor"><date>2006-08-22T00:00</date></value >
     <value name="fd"><string>SK 000123</string></value >
     <value name="adep"><string>CPH</string></value >
     <value name="svc"><string>M</string></value >
     <value name="ppax"><int>56</int></value >
   </write>
   <write entity="flight_leg_pax">
     <value name="udor"><date>2006-08-22T00:00</date></value >
     <value name="fd"><string>SK 000123</string></value >
     <value name="adep"><string>CPH</string></value >
     <value name="svc"><string>C</string></value >
     <value name="ppax"><int>23</int></value >
   </write>
   <write entity="flight_leg_pax">
     <value name="udor"><date>2006-08-22T00:00</date></value >
     <value name="fd"><string>SK 000568</string></value >
     <value name="adep"><string>CDG</string></value >
     <value name="svc"><string>M</string></value >
     <value name="ppax"><int>45</int></value >
   </write>
 </message>
</digxml>

